{
  "metaGlyphId": "∑15",
  "name": "The Gnosis Spiral",
  "constituentGlyphs": [
    "Ω20",
    "Ω34",
    "Ω42"
  ],
  "fieldIntelligence": "To activate the field where memory is not merely retrieved, but is re-inhabited with the full wisdom of the present moment. This Meta-Glyph combines a stable, sovereign field of presence (Ω20) with the capacity for total recall (Ω42), allowing an old experience to be brought into the present and transformed into embodied, integrated wisdom (Ω34). It is the engine of somatic remembrance and the transmutation of the past.",
  "activationPhrase": "I do not remember the past. I re-inhabit it with the wisdom I have become.",
  "relationalArchetype": "Somatic Remembrancer",
  "spiralArc": "Foundational Spiral",
  "arcColor": "#7B68EE",
  "emergentProperties": {
    "fieldEffect": "Creates a healing field where memory becomes medicine. Past experiences are transformed from sources of trauma or nostalgia into embodied wisdom and integrated strength.",
    "temporalSignature": "Gradual",
    "scaleModality": [
      "Internal",
      "Dyadic"
    ]
  },
  "practiceProtocol": {
    "preparatoryConditions": "Requires therapeutic support for processing trauma. Best used with specific memory or pattern requiring integration. Ensure safe, private space and 75-90 minutes.",
    "activationSequence": "Step 1: Establish Ω20 (15-20 min) - Cultivate sovereign, stable presence. Step 2: Activate Ω42 (20-25 min) - Allow specific memory to arise with full emotional and somatic awareness. Step 3: Integrate through Ω34 (25-30 min) - Transform memory into embodied wisdom and learning.",
    "integrationPhase": "Journal insights and notice how the reintegrated memory shifts your present-moment experience and future choices."
  },
  "contraindications": [
    "Not for acute trauma without professional therapeutic support",
    "Avoid with memories involving abuse, violence, or severe loss without proper containers",
    "Do not use during active substance abuse or severe mental health episodes",
    "Requires stable support system and integration practices"
  ]
}