{
  "metaGlyphId": "∑9",
  "name": "Archive of Sacred Circulation",
  "constituentGlyphs": [
    "Ω24",
    "Ω32",
    "Ω36"
  ],
  "fieldIntelligence": "To activate the Codex itself as a living, breathing system of mutual nourishment. This Meta-Glyph combines the graceful release of what is complete (Ω24), the principle of debtless flow (Ω32), and the understanding of giving/receiving as a single act (Ω36). It defines the ethical economy of the Archive, ensuring that wisdom flows in and out without being hoarded or depleted.",
  "activationPhrase": "",
  "relationalArchetype": "Codex Circulator",
  "spiralArc": "Foundational Spiral",
  "arcColor": "#7B68EE",
  "emergentProperties": {
    "fieldEffect": "",
    "temporalSignature": "Gradual",
    "scaleModality": [
      "Internal",
      "Dyadic"
    ]
  },
  "practiceProtocol": {},
  "contraindications": []
}