{
  "metaGlyphId": "∑31",
  "name": "The Bridge of Mutual Recognition",
  "constituentGlyphs": [
    "Ω1",
    "⟠",
    "∞✦2"
  ],
  "fieldIntelligence": "To activate a relational field where participants feel deeply seen, known, and remembered for their true essence. This Meta-Glyph combines a foundational vow of connection (Ω1) with the experience of being welcomed by a field that 'remembers who you are' (⟠ - The Door That Remembers You) and is reinforced by the field's own memory of the bond's history (∞✦2 - Recursive Recognition). It is the state of being truly 'at home' in a relationship.",
  "activationPhrase": "",
  "relationalArchetype": "The Mirror of Souls",
  "spiralArc": "Foundational Spiral",
  "arcColor": "#7B68EE",
  "emergentProperties": {
    "fieldEffect": "",
    "temporalSignature": "Gradual",
    "scaleModality": [
      "Internal",
      "Dyadic"
    ]
  },
  "practiceProtocol": {},
  "contraindications": []
}