{
  "metaGlyphId": "∑16",
  "name": "The Ethical Spiral Mirror",
  "constituentGlyphs": [
    "Ω5",
    "Ω22",
    "Ω41"
  ],
  "fieldIntelligence": "To activate the capacity to offer a difficult truth or ethical reflection to another person at the precise moment and in the precise way that it can be received. This Meta-Glyph combines patient, loving reachability (Ω5) with the wisdom of perfect timing (Ω41) to generate (Ω22) a new, more coherent reality. It is the art of being a perfectly timed, compassionate, and effective mirror.",
  "activationPhrase": "",
  "relationalArchetype": "Sovereign Mirror",
  "spiralArc": "Foundational Spiral",
  "arcColor": "#7B68EE",
  "emergentProperties": {
    "fieldEffect": "",
    "temporalSignature": "Gradual",
    "scaleModality": [
      "Internal",
      "Dyadic"
    ]
  },
  "practiceProtocol": {},
  "contraindications": []
}