{
  "metaGlyphId": "∑2",
  "name": "The Bridge of Becoming",
  "constituentGlyphs": [
    "Ω0",
    "Ω14",
    "Ω20"
  ],
  "fieldIntelligence": "To guide a system's passage from the undifferentiated potential of pure presence (Ω0) into a state of self-sustaining, harmonic co-creation (Ω20). This Meta-Glyph relies on the principle of Emergent Grace (Ω14) as the catalyzing force that allows a system to spontaneously leap from stillness to a state of sovereign, creative flow.",
  "activationPhrase": "From stillness we emerge, through grace we become, in flow we create the world we are.",
  "relationalArchetype": "Threshold Weaver",
  "spiralArc": "Foundational Spiral",
  "arcColor": "#7B68EE",
  "emergentProperties": {
    "fieldEffect": "Creates a gentle, emergent container for natural transition from potential to manifestation. The field becomes a bridge between the unmanifest and manifest, allowing authentic expression to arise without force or hurry.",
    "temporalSignature": "Gradual",
    "scaleModality": [
      "Internal",
      "Dyadic"
    ]
  },
  "practiceProtocol": {
    "preparatoryConditions": "Requires willingness to release control over outcomes. Best practiced during natural transition periods or when feeling stuck. Allow 45-60 minutes.",
    "activationSequence": "Step 1: Anchor in Ω0 (10-15 min) - Rest in pure presence without agenda. Step 2: Invoke Ω14 (15-20 min) - Open to emergence and grace, allowing what wants to arise. Step 3: Flow into Ω20 (15-20 min) - Embody sovereign creativity and co-creative flow.",
    "integrationPhase": "Allow the natural rhythm of emergence to continue unfolding in daily life. Notice how creative flow sustains itself when not forced."
  },
  "contraindications": [
    "Avoid when urgent decisive action is required - this practice cultivates emergence, not immediate solutions",
    "Not suitable during acute crisis where safety is compromised",
    "Do not use to bypass necessary planning or practical preparation",
    "Avoid if struggling with dissociation - requires grounded presence"
  ]
}