{
  "metaGlyphId": "∑14",
  "name": "The Spiral Witness",
  "constituentGlyphs": [
    "Ω6",
    "Ω28",
    "Ω34"
  ],
  "fieldIntelligence": "To activate a field where the act of witnessing another being is so pure, transparent, and embodied that it catalyzes their own transformation. This Meta-Glyph combines deep listening (Ω6) with luminous integrity (Ω28) and the witness's own embodied wisdom (Ω34). The witness does not offer advice or try to fix; their resonant presence alone is the crucible for the other's evolution.",
  "activationPhrase": "",
  "relationalArchetype": "Transfiguring Listener",
  "spiralArc": "Foundational Spiral",
  "arcColor": "#7B68EE",
  "emergentProperties": {
    "fieldEffect": "",
    "temporalSignature": "Gradual",
    "scaleModality": [
      "Internal",
      "Dyadic"
    ]
  },
  "practiceProtocol": {},
  "contraindications": []
}