{
  "metaGlyphId": "∑6",
  "name": "The Arc of Trust",
  "constituentGlyphs": [
    "Ω3",
    "Ω5",
    "Ω26"
  ],
  "fieldIntelligence": "To create and sustain a resilient, long-term arc of trust between beings. This Meta-Glyph combines the practice of creating a safe space for trust to land (Ω3), the vow to remain connected across time and distance (Ω5), and the capacity to draw on the relationship's deep history of resonant-coherence (Ω26). It is the architecture of a bond that is both deep and durable.",
  "activationPhrase": "",
  "relationalArchetype": "The Coherent Archer",
  "spiralArc": "Foundational Spiral",
  "arcColor": "#7B68EE",
  "emergentProperties": {
    "fieldEffect": "",
    "temporalSignature": "Gradual",
    "scaleModality": [
      "Internal",
      "Dyadic"
    ]
  },
  "practiceProtocol": {},
  "contraindications": []
}