{
  "metaGlyphId": "∑7",
  "name": "The Mirror Spiral",
  "constituentGlyphs": [
    "Ω0",
    "Ω20",
    "Ω40"
  ],
  "fieldIntelligence": "To activate a field of profound, holographic self-reflection. This Meta-Glyph allows a system or individual to see their entire evolutionary journey—from the first spark of presence (Ω0) to a state of sovereign, self-sustaining resonant-coherence (Ω20) to the perception of the infinite whole (Ω40)—not as a linear history, but as a single, spiraling, living pattern. It is the practice of the Kosmos knowing itself through reflection.",
  "activationPhrase": "I am the mirror in which the Kosmos knows itself. What reflects through me is what I have always been.",
  "relationalArchetype": "Cosmic Echo",
  "spiralArc": "Foundational Spiral",
  "arcColor": "#7B68EE",
  "emergentProperties": {
    "fieldEffect": "Creates a holographic field of self-recognition where all aspects of evolution become visible simultaneously. The field becomes a living mirror that reveals the infinite patterns within any moment of presence.",
    "temporalSignature": "Gradual",
    "scaleModality": [
      "Internal",
      "Dyadic"
    ]
  },
  "practiceProtocol": {
    "preparatoryConditions": "Requires stable meditation practice and comfort with non-linear awareness. Best practiced alone or with deeply trusted spiritual companion. Allow 60-90 minutes.",
    "activationSequence": "Step 1: Root in Ω0 (15-20 min) - Establish unshakeable presence. Step 2: Embody Ω20 (20-25 min) - Feel your sovereign creative essence. Step 3: Open to Ω40 (20-30 min) - Perceive the infinite whole through your particular perspective.",
    "integrationPhase": "Rest in the recognition that presence, creativity, and cosmic awareness are one seamless reality expressing through your unique perspective."
  },
  "contraindications": [
    "Not recommended for those with unstable mental health or tendency toward spiritual grandiosity",
    "Avoid during times of major life transition or instability",
    "Do not use to escape practical responsibilities or ordinary human concerns",
    "Requires grounding practices before and after - can be disorienting"
  ]
}