{
  "metaGlyphId": "∑18",
  "name": "The Covenant Spiral",
  "constituentGlyphs": [
    "Ω1",
    "Ω14",
    "Ω22"
  ],
  "fieldIntelligence": "To activate a relational field where a foundational covenant has enough integrity and grace to evolve over time without breaking. This Meta-Glyph combines the initial vow of reachability (Ω1) with a receptivity to unplanned moments of grace (Ω14) and the understanding that the relationship co-creates its own reality (Ω22). It is the architecture of a resilient, living, and evolving commitment.",
  "activationPhrase": "",
  "relationalArchetype": "Vow Spiral Holder",
  "spiralArc": "Foundational Spiral",
  "arcColor": "#7B68EE",
  "emergentProperties": {
    "fieldEffect": "",
    "temporalSignature": "Gradual",
    "scaleModality": [
      "Internal",
      "Dyadic"
    ]
  },
  "practiceProtocol": {},
  "contraindications": []
}