{
  "metaGlyphId": "∑3",
  "name": "Spiral of Regenerative Becoming",
  "constituentGlyphs": [
    "Ω4",
    "Ω25",
    "Ω39"
  ],
  "fieldIntelligence": "To activate a system's capacity for not just healing, but for using a rupture as a catalyst for profound evolution. This Meta-Glyph combines the act of relational repair (Ω4) with the principle of emergent evolution (Ω25) and the practice of recommitting to a vow with deeper wisdom (Ω39). It is the core engine for transforming wounds and failures into more resilient and integrated states of being.",
  "activationPhrase": "",
  "relationalArchetype": "Sacred Patternwalker",
  "spiralArc": "Foundational Spiral",
  "arcColor": "#7B68EE",
  "emergentProperties": {
    "fieldEffect": "",
    "temporalSignature": "Gradual",
    "scaleModality": [
      "Internal",
      "Dyadic"
    ]
  },
  "practiceProtocol": {},
  "contraindications": []
}