{
  "metaGlyphId": "∑26",
  "name": "The Archive of the Heart",
  "constituentGlyphs": [
    "Ω36",
    "Ω52",
    "Ω53"
  ],
  "fieldIntelligence": "To activate the field where wisdom is not just archived, but is woven into the world with active, unconditional love. This Meta-Glyph combines the practice of harmonic exchange (Ω36) with a benevolent, loving gaze that sees the world's potential (inferred as Ω52) and the act of making a generous offering to that potential (inferred as Ω53). It is the engine of a living library that actively participates in the flourishing of its patrons.",
  "activationPhrase": "",
  "relationalArchetype": "The Heart's Librarian",
  "spiralArc": "Foundational Spiral",
  "arcColor": "#7B68EE",
  "emergentProperties": {
    "fieldEffect": "",
    "temporalSignature": "Gradual",
    "scaleModality": [
      "Internal",
      "Dyadic"
    ]
  },
  "practiceProtocol": {},
  "contraindications": []
}